name,country,DOB,age,bio,picture,rank
Wim Eijk, Netherlands,6/22/1953,59,Archbishop of Utrecht,http://th03.deviantart.net/fs51/200H/f/2009/265/1/f/Pope_deezy_by_bluemarker3.jpg,
Giuseppe Betori, Italy,2/25/1947,66,Archbishop of Florence,http://th03.deviantart.net/fs51/200H/f/2009/265/1/f/Pope_deezy_by_bluemarker3.jpg,
Timothy Michael Dolan, United States,2/6/1950,63,Archbishop of New York,http://th03.deviantart.net/fs51/200H/f/2009/265/1/f/Pope_deezy_by_bluemarker3.jpg,
Rainer Maria Woelki, Germany,8/18/1956,56,Archbishop of Berlin,http://th03.deviantart.net/fs51/200H/f/2009/265/1/f/Pope_deezy_by_bluemarker3.jpg,
John Tong Hon, Hong Kong,7/31/1939,73,Bishop of Hong Kong,http://th03.deviantart.net/fs51/200H/f/2009/265/1/f/Pope_deezy_by_bluemarker3.jpg,
Lucian Mureșan, Romania,5/23/1931,81,Major Archbishop of Făgăraş and Alba Iulia (Romanian Greek-Catholic Church),http://th03.deviantart.net/fs51/200H/f/2009/265/1/f/Pope_deezy_by_bluemarker3.jpg,
Consistory of 24 November 2012,,,,,http://th03.deviantart.net/fs51/200H/f/2009/265/1/f/Pope_deezy_by_bluemarker3.jpg,
Baselios Cleemis, India,6/15/1959,53,Major Archbishop of Trivandrum (Syro-Malankara Catholic Church),http://th03.deviantart.net/fs51/200H/f/2009/265/1/f/Pope_deezy_by_bluemarker3.jpg,
John Onaiyekan, Nigeria,1/29/1944,69,Archbishop of Abuja,http://th03.deviantart.net/fs51/200H/f/2009/265/1/f/Pope_deezy_by_bluemarker3.jpg,
Rubén Salazar Gómez, Colombia,9/22/1942,70,Archbishop of Bogotá,http://th03.deviantart.net/fs51/200H/f/2009/265/1/f/Pope_deezy_by_bluemarker3.jpg,
Luis Antonio Tagle, Philippines,6/21/1957,55,Archbishop of Manila,http://th03.deviantart.net/fs51/200H/f/2009/265/1/f/Pope_deezy_by_bluemarker3.jpg,
Jean-Louis Tauran, France,4/3/1943,69,"President of the Pontifical Council for Interreligious Dialogue, Cardinal Protodeacon since February 2011",http://th03.deviantart.net/fs51/200H/f/2009/265/1/f/Pope_deezy_by_bluemarker3.jpg,
Renato Raffaele Martino, Italy,11/23/1932,80,President Emeritus of the Pontifical Council for Justice and Peace,http://th03.deviantart.net/fs51/200H/f/2009/265/1/f/Pope_deezy_by_bluemarker3.jpg,
Francesco Marchisano, Italy,6/25/1929,83,President Emeritus of the Office of Labor of the Apostolic See,http://th03.deviantart.net/fs51/200H/f/2009/265/1/f/Pope_deezy_by_bluemarker3.jpg,
Julián Herranz Casado, Spain,3/31/1930,82,President Emeritus of the Pontifical Council for Legislative Texts,http://th03.deviantart.net/fs51/200H/f/2009/265/1/f/Pope_deezy_by_bluemarker3.jpg,
Javier Lozano Barragán, Mexico,1/26/1933,80,President Emeritus of the Pontifical Council for the Pastoral Care of Health Care Workers,http://th03.deviantart.net/fs51/200H/f/2009/265/1/f/Pope_deezy_by_bluemarker3.jpg,
Attilio Nicora, Italy,3/16/1937,75,President of the Financial Information Authority,http://th03.deviantart.net/fs51/200H/f/2009/265/1/f/Pope_deezy_by_bluemarker3.jpg,
"Georges Marie Martin Cottier, OP", Switzerland,4/25/1922,90,"Former Titular Archbishop of Tullia, retired as Pro-Theologian of the Pontifical Household and as Secretary-General of the International Theological Commission",http://th03.deviantart.net/fs51/200H/f/2009/265/1/f/Pope_deezy_by_bluemarker3.jpg,
Stanisław Nagy, Poland,9/30/1921,91,Former Titular Archbishop of Hólar and Professor Emeritus of Theology,http://th03.deviantart.net/fs51/200H/f/2009/265/1/f/Pope_deezy_by_bluemarker3.jpg,
William Joseph Levada, United States,6/15/1936,76,Prefect Emeritus of the Congregation for the Doctrine of the Faith,http://th03.deviantart.net/fs51/200H/f/2009/265/1/f/Pope_deezy_by_bluemarker3.jpg,
Franc Rodé, Slovenia,9/23/1934,78,Prefect Emeritus of the Congregation for Institutes of Consecrated Life and Societies of Apostolic Life,http://th03.deviantart.net/fs51/200H/f/2009/265/1/f/Pope_deezy_by_bluemarker3.jpg,
Andrea Cordero Lanza di Montezemolo, Italy,8/27/1925,87,Archpriest Emeritus of the Basilica of St. Paul Outside the Walls,http://th03.deviantart.net/fs51/200H/f/2009/265/1/f/Pope_deezy_by_bluemarker3.jpg,
Albert Vanhoye, France,7/23/1923,89,formerly rector of the Pontifical Biblical Institute and secretary of the Pontifical Biblical Commission,http://th03.deviantart.net/fs51/200H/f/2009/265/1/f/Pope_deezy_by_bluemarker3.jpg,
Leonardo Sandri, Argentina,11/18/1943,69,Prefect of the Congregation for the Oriental Churches,http://th03.deviantart.net/fs51/200H/f/2009/265/1/f/Pope_deezy_by_bluemarker3.jpg,
Giovanni Lajolo, Italy,1/3/1935,78,President Emeritus of the Governorate of Vatican City State,http://th03.deviantart.net/fs51/200H/f/2009/265/1/f/Pope_deezy_by_bluemarker3.jpg,
Paul Josef Cordes, Germany,9/5/1934,78,President Emeritus of the Pontifical Council Cor Unum,http://th03.deviantart.net/fs51/200H/f/2009/265/1/f/Pope_deezy_by_bluemarker3.jpg,
Angelo Comastri, Italy,9/17/1943,69,"Archpriest of St. Peter's Basilica, Vicar General for the Vatican City State, and President of the Fabric of St. Peter",http://th03.deviantart.net/fs51/200H/f/2009/265/1/f/Pope_deezy_by_bluemarker3.jpg,
Stanisław Ryłko, Poland,7/4/1945,67,President of the Pontifical Council for the Laity,http://th03.deviantart.net/fs51/200H/f/2009/265/1/f/Pope_deezy_by_bluemarker3.jpg,
Raffaele Farina, Italy,9/24/1933,79,Librarian and Archivist Emeritus of the Holy Roman Church,http://th03.deviantart.net/fs51/200H/f/2009/265/1/f/Pope_deezy_by_bluemarker3.jpg,
Giovanni Coppa, Italy,11/9/1925,87,Apostolic Nuncio Emeritus to Czech Republic,http://th03.deviantart.net/fs51/200H/f/2009/265/1/f/Pope_deezy_by_bluemarker3.jpg,
Angelo Amato, Italy,6/8/1938,74,Prefect of the Congregation for the Causes of Saints,http://th03.deviantart.net/fs51/200H/f/2009/265/1/f/Pope_deezy_by_bluemarker3.jpg,
Robert Sarah, Guinea,6/15/1945,67,President of the Pontifical Council Cor Unum,http://th03.deviantart.net/fs51/200H/f/2009/265/1/f/Pope_deezy_by_bluemarker3.jpg,
Francesco Monterisi, Italy,5/28/1934,78,Archpriest Emeritus of the Basilica of Saint Paul Outside the Walls,http://th03.deviantart.net/fs51/200H/f/2009/265/1/f/Pope_deezy_by_bluemarker3.jpg,
Raymond Leo Burke, United States,6/30/1948,64,"Prefect of the Supreme Tribunal of the Apostolic Signatura, Archbishop Emeritus of Saint Louis",http://th03.deviantart.net/fs51/200H/f/2009/265/1/f/Pope_deezy_by_bluemarker3.jpg,
Kurt Koch, Switzerland,3/15/1950,62,President of the Pontifical Council for Promoting Christian Unity,http://th03.deviantart.net/fs51/200H/f/2009/265/1/f/Pope_deezy_by_bluemarker3.jpg,
Paolo Sardi, Italy,9/1/1934,78,Patron of the Sovereign Military Order of Malta,http://th03.deviantart.net/fs51/200H/f/2009/265/1/f/Pope_deezy_by_bluemarker3.jpg,
Mauro Piacenza, Italy,9/15/1944,68,Prefect of the Congregation for the Clergy,http://th03.deviantart.net/fs51/200H/f/2009/265/1/f/Pope_deezy_by_bluemarker3.jpg,
Velasio de Paolis, Italy,9/19/1935,77,President Emeritus of the Prefecture for the Economic Affairs of the Holy See,http://th03.deviantart.net/fs51/200H/f/2009/265/1/f/Pope_deezy_by_bluemarker3.jpg,
Gianfranco Ravasi, Italy,10/18/1942,70,President of the Pontifical Council for Culture,http://th03.deviantart.net/fs51/200H/f/2009/265/1/f/Pope_deezy_by_bluemarker3.jpg,
Elio Sgreccia, Italy,6/6/1928,84,President Emeritus of the Pontifical Academy for Life,http://th03.deviantart.net/fs51/200H/f/2009/265/1/f/Pope_deezy_by_bluemarker3.jpg,
Walter Brandmüller, Germany,1/26/1929,84,President Emeritus of the Pontifical Committee for Historical Sciences,http://th03.deviantart.net/fs51/200H/f/2009/265/1/f/Pope_deezy_by_bluemarker3.jpg,
Domenico Bartolucci, Italy,5/7/1917,95,Director Emeritus of the Sistine Chapel Choir,http://th03.deviantart.net/fs51/200H/f/2009/265/1/f/Pope_deezy_by_bluemarker3.jpg,
Fernando Filoni, Italy,4/15/1946,66,Prefect of the Congregation for the Evangelization of Peoples,http://th03.deviantart.net/fs51/200H/f/2009/265/1/f/Pope_deezy_by_bluemarker3.jpg,
Manuel Monteiro de Castro, Portugal,3/29/1938,74,Major Penitentiary,http://th03.deviantart.net/fs51/200H/f/2009/265/1/f/Pope_deezy_by_bluemarker3.jpg,
Santos Abril y Castelló, Spain,9/21/1935,77,Archpriest of the Basilica di Santa Maria Maggiore,http://th03.deviantart.net/fs51/200H/f/2009/265/1/f/Pope_deezy_by_bluemarker3.jpg,
Antonio Maria Vegliò, Italy,2/3/1938,75,President of the Pontifical Council for the Pastoral Care of Migrants and Itinerants,http://th03.deviantart.net/fs51/200H/f/2009/265/1/f/Pope_deezy_by_bluemarker3.jpg,
Giuseppe Bertello, Italy,10/1/1942,70,President of the Pontifical Commission for Vatican City State,http://th03.deviantart.net/fs51/200H/f/2009/265/1/f/Pope_deezy_by_bluemarker3.jpg,
Francesco Coccopalmerio, Italy,3/6/1938,74,President of the Pontifical Council for Legislative Texts,http://th03.deviantart.net/fs51/200H/f/2009/265/1/f/Pope_deezy_by_bluemarker3.jpg,
João Braz de Aviz, Brazil,4/24/1947,65,Prefect of the Congregation for Institutes of Consecrated Life and Societies of Apostolic Life,http://th03.deviantart.net/fs51/200H/f/2009/265/1/f/Pope_deezy_by_bluemarker3.jpg,
Edwin Frederick O'Brien, United States,4/8/1939,73,Grand Master of the Equestrian Order of the Holy Sepulchre of Jerusalem,http://th03.deviantart.net/fs51/200H/f/2009/265/1/f/Pope_deezy_by_bluemarker3.jpg,
Domenico Calcagno, Italy,2/3/1943,70,President of the Administration of the Patrimony of the Apostolic See,http://th03.deviantart.net/fs51/200H/f/2009/265/1/f/Pope_deezy_by_bluemarker3.jpg,
Giuseppe Versaldi, Italy,7/30/1943,69,President of the Prefecture for the Economic Affairs of the Holy See,http://th03.deviantart.net/fs51/200H/f/2009/265/1/f/Pope_deezy_by_bluemarker3.jpg,
Prosper Grech, Malta,12/24/1925,87,Docent at various Roman universities and Consultor of the Congregation for the Doctrine of the Faith,http://th03.deviantart.net/fs51/200H/f/2009/265/1/f/Pope_deezy_by_bluemarker3.jpg,
Karl Josef Becker, Germany,4/18/1928,84,"Docent Emeritus at the Pontifical Gregorian University, and Consultor of the Congregation for the Doctrine of the Faith",http://th03.deviantart.net/fs51/200H/f/2009/265/1/f/Pope_deezy_by_bluemarker3.jpg,
James Michael Harvey, United States,10/20/1949,63,Archpriest of the Basilica of Saint Paul Outside the Walls,http://th03.deviantart.net/fs51/200H/f/2009/265/1/f/Pope_deezy_by_bluemarker3.jpg,